{
  "schema_version": "0.3.0",
  "kind": "proxmenux.oci-template",
  "id": "linuxserver-doplarr-rs",
  "status": "generated-unvalidated",
  "catalog_ui": {
    "title": {
      "en_US": "Doplarr_Rs"
    },
    "tagline": {
      "en_US": "Doplarr_rs is a Discord bot for requesting media through *arr backends, written in Rust."
    },
    "description": {
      "en_US": "Doplarr_rs is a Discord bot for requesting media through *arr backends, written in Rust."
    },
    "category": "arr",
    "category_label": "*Arr Suite",
    "author": "LinuxServer.io",
    "developer": null,
    "icon": "https://cdn.jsdelivr.net/gh/linuxserver/docker-templates@master/linuxserver.io/img/doplarr_rs-logo.png",
    "thumbnail": "https://raw.githubusercontent.com/linuxserver/docker-templates/master/linuxserver.io/img/doplarr_rs-banner.png",
    "screenshots": [],
    "architectures": [
      "amd64",
      "arm64"
    ],
    "launch": {
      "scheme": "http",
      "port": null,
      "path": "/"
    },
    "website": "https://github.com/activexray/doplarr_rs",
    "documentation": "https://docs.linuxserver.io/images/docker-doplarr_rs/",
    "repository": "https://github.com/linuxserver/docker-doplarr_rs",
    "tips": [],
    "mini_changelog": [
      {
        "date": "2026-06-22",
        "note": "Initial Release."
      }
    ],
    "display_version": null,
    "updated_at": "2026-06-22"
  },
  "source": {
    "provider": "linuxserver.io",
    "repository": "https://github.com/linuxserver/docker-doplarr_rs",
    "default_branch": "main",
    "revision": "cdbc28479471da2c653feeb549341d1a0f518d07",
    "readme_raw_url": "https://raw.githubusercontent.com/linuxserver/docker-doplarr_rs/cdbc28479471da2c653feeb549341d1a0f518d07/README.md",
    "readme_pushed_at": "2026-09-10T18:29:06Z",
    "compose_sha256": "1ddaa7250b2fd7e656df299b62cdc3b8e806b283482f9537780f596fc64ddfb9",
    "generated_at": "2026-09-12T14:37:25+00:00"
  },
  "container_contract": {
    "service_name": "doplarr_rs",
    "container_name": "doplarr_rs",
    "image": {
      "reference": "lscr.io/linuxserver/doplarr_rs:latest",
      "registry": "lscr.io",
      "repository": "lscr.io/linuxserver/doplarr_rs",
      "tag": "latest",
      "digest": null,
      "pull_policy": "resolve-selected-tag-to-architecture-digest-at-install"
    },
    "environment": [
      {
        "name": "PUID",
        "example": "1000",
        "required": true,
        "sensitive": false,
        "source": "linuxserver-compose"
      },
      {
        "name": "PGID",
        "example": "1000",
        "required": true,
        "sensitive": false,
        "source": "linuxserver-compose"
      },
      {
        "name": "TZ",
        "example": "Etc/UTC",
        "required": true,
        "sensitive": false,
        "source": "linuxserver-compose"
      }
    ],
    "volumes": [
      {
        "id": "volume-0",
        "container_path": "/config",
        "compose_source_example": "/path/to/doplarr_rs/config",
        "read_only": false,
        "required": true,
        "installation_choice": [
          "managed-volume",
          "host-bind"
        ],
        "default": "managed-volume",
        "managed_volume": {
          "backup": true,
          "default_size_gb": 4
        }
      }
    ],
    "ports": [],
    "related_services": [],
    "restart": "unless-stopped",
    "stop_grace_period": null,
    "original_compose": "---\nservices:\n  doplarr_rs:\n    image: lscr.io/linuxserver/doplarr_rs:latest\n    container_name: doplarr_rs\n    environment:\n      - PUID=1000\n      - PGID=1000\n      - TZ=Etc/UTC\n    volumes:\n      - /path/to/doplarr_rs/config:/config\n    restart: unless-stopped\n"
  },
  "first_run": {
    "endpoints": [],
    "credentials": []
  },
  "proxmox": {
    "runtime": "native-oci-lxc",
    "technology_status": "proxmox-technology-preview",
    "defaults": {
      "unprivileged": true,
      "ostype": "auto-from-image",
      "cores": 2,
      "memory_mb": 1024,
      "swap_mb": 512,
      "rootfs_size_gb": 8,
      "rootfs_storage": "local-lvm",
      "volume_storage": "local-lvm",
      "template_storage": "local",
      "bridge": "vmbr0",
      "ipv4": "dhcp",
      "firewall": true,
      "host_managed_network": true,
      "onboot": false,
      "features": [
        "nesting=1"
      ],
      "shutdown_timeout_seconds": 30
    },
    "image_metadata_policy": {
      "entrypoint": "import-from-oci-image",
      "cmd": "import-from-oci-image",
      "environment": "import-image-env-then-apply-compose-overrides",
      "user": "import-from-oci-image",
      "working_dir": "import-from-oci-image",
      "stop_signal": "import-from-oci-image"
    },
    "adaptations": [
      {
        "id": "dedicated-lxc-network",
        "upstream_behavior": "Docker publishes selected container ports on the Docker host.",
        "native_lxc_behavior": "The application listens on the same container ports at its dedicated LXC address.",
        "reason": "A native LXC has its own address and does not require Docker port NAT.",
        "behavioral_impact": "Users open the LXC address instead of the Proxmox host address.",
        "validation": "pending-per-application"
      },
      {
        "id": "compose-environment-overlay",
        "upstream_behavior": "Compose environment values override OCI image environment values.",
        "native_lxc_behavior": "ProxMenux merges the same values into lxc.environment.runtime while the CT is stopped.",
        "reason": "PVE imports image Env automatically; Compose values still need to override it.",
        "behavioral_impact": "None expected.",
        "validation": "pending-per-application"
      },
      {
        "id": "stop-grace-period",
        "upstream_behavior": "Docker waits for Compose stop_grace_period before forcing termination.",
        "native_lxc_behavior": "ProxMenux records the same timeout for its pct shutdown lifecycle operations.",
        "reason": "Proxmox has no equivalent per-CT persistent restart-policy field; startup.down is not a shutdown timeout.",
        "behavioral_impact": "Normal Proxmox node shutdown remains governed by the node-wide shutdown policy.",
        "validation": "not-requested-by-compose"
      }
    ],
    "installer_profile": {
      "volume_preparations": [
        {
          "container_path": "/config",
          "remove_lost_found": true,
          "owner_strategy": "mapped-root",
          "only_when_mount_type": "managed-volume"
        }
      ]
    }
  },
  "compatibility": {
    "automatic_install_candidate": true,
    "validated": false,
    "supported_compose_keys": [
      "container_name",
      "environment",
      "image",
      "ports",
      "restart",
      "stop_grace_period",
      "volumes"
    ],
    "untranslated_blockers": [],
    "policy": "A generated template is never promoted to validated without install, health, restart and persistence tests."
  },
  "validation": {
    "schema": "passed-at-generation",
    "clean_install": "pending",
    "service_health": "pending",
    "restart_persistence": "pending",
    "backup_restore": "pending",
    "update_preserves_data": "pending"
  },
  "lifecycle": {
    "update_strategy": "replace-rootfs-from-new-oci-image-preserve-managed-volumes",
    "registry_state": {
      "resolved_architecture": null,
      "resolved_digest": null,
      "image_version_label": null,
      "image_created": null
    },
    "change_detection": "compare-resolved-architecture-digest",
    "automatic_unattended_updates": false
  }
}
